{
  "schema_version": "1",
  "source": {"kind": "hcl", "root_module": "infra/prod"},
  "terraform": {
    "required_version": ">= 1.6",
    "backend": {"type": "s3", "values": {"bucket": "tf-state", "encrypt": true}, "unknown": []},
    "required_providers": {"aws": {"source": "registry.terraform.io/hashicorp/aws", "version": "~> 6.0"}}
  },
  "provider_versions": {"registry.terraform.io/hashicorp/aws": "6.12.0"},
  "providers": [],
  "resources": [
    {
      "address": "aws_instance.web",
      "base_address": "aws_instance.web",
      "mode": "managed",
      "type": "aws_instance",
      "name": "web",
      "index": null,
      "module": "",
      "provider": "registry.terraform.io/hashicorp/aws",
      "provider_config": "",
      "values": {
        "ami": "ami-0123456789abcdef0",
        "instance_type": "t3.micro",
        "subnet_id": null,
        "metadata_options": [{"http_tokens": "optional"}]
      },
      "unknown": [["subnet_id"]],
      "sensitive": [],
      "references": {"subnet_id": ["aws_subnet.private"]},
      "meta": {"count_unknown": false, "for_each_unknown": false, "depends_on": [], "lifecycle": {}},
      "source": {
        "file": "infra/prod/compute.tf",
        "range": {"start_line": 1, "start_column": 1, "end_line": 12, "end_column": 2},
        "attributes": {
          "metadata_options.0.http_tokens": {"start_line": 9, "start_column": 5, "end_line": 9, "end_column": 29}
        }
      }
    }
  ],
  "module_calls": [],
  "variables": [{"name": "env", "module": "", "sensitive": false, "has_default": true, "type": "string"}],
  "outputs": [],
  "coverage_gaps": []
}
