[
  {
    "schema_version": "1",
    "source": {
      "kind": "hcl",
      "root_module": "."
    },
    "terraform": {
      "required_version": "",
      "backend": {
        "type": "s3",
        "values": {
          "access_key": "<redacted>",
          "bucket": "example-tf-state",
          "key": "state/terraform.tfstate"
        },
        "unknown": []
      },
      "required_providers": {
        "aws": {
          "source": "registry.terraform.io/hashicorp/aws",
          "version": "~> 6.0"
        }
      }
    },
    "provider_versions": {},
    "providers": [],
    "resources": [
      {
        "address": "aws_db_instance.main",
        "base_address": "aws_db_instance.main",
        "mode": "managed",
        "type": "aws_db_instance",
        "name": "main",
        "index": null,
        "module": "",
        "provider": "registry.terraform.io/hashicorp/aws",
        "provider_config": "",
        "values": {
          "allocated_storage": 20,
          "engine": "postgres",
          "identifier": "example-db",
          "instance_class": "db.t3.micro",
          "password": "<redacted>",
          "username": "app"
        },
        "unknown": [],
        "sensitive": [
          [
            "password"
          ]
        ],
        "references": {},
        "meta": {
          "count_unknown": false,
          "for_each_unknown": false,
          "depends_on": [],
          "lifecycle": {}
        },
        "source": {
          "file": "main.tf",
          "range": {
            "start_line": 23,
            "start_column": 1,
            "end_line": 30,
            "end_column": 2
          },
          "attributes": {
            "allocated_storage": {
              "start_line": 27,
              "start_column": 23,
              "end_line": 27,
              "end_column": 25
            },
            "engine": {
              "start_line": 25,
              "start_column": 23,
              "end_line": 25,
              "end_column": 33
            },
            "identifier": {
              "start_line": 24,
              "start_column": 23,
              "end_line": 24,
              "end_column": 35
            },
            "instance_class": {
              "start_line": 26,
              "start_column": 23,
              "end_line": 26,
              "end_column": 36
            },
            "password": {
              "start_line": 29,
              "start_column": 23,
              "end_line": 29,
              "end_column": 38
            },
            "username": {
              "start_line": 28,
              "start_column": 23,
              "end_line": 28,
              "end_column": 28
            }
          }
        }
      },
      {
        "address": "aws_rds_cluster.main",
        "base_address": "aws_rds_cluster.main",
        "mode": "managed",
        "type": "aws_rds_cluster",
        "name": "main",
        "index": null,
        "module": "",
        "provider": "registry.terraform.io/hashicorp/aws",
        "provider_config": "",
        "values": {
          "cluster_identifier": "example-cluster",
          "engine": "aurora-postgresql",
          "master_password": "<redacted>",
          "master_username": "app"
        },
        "unknown": [],
        "sensitive": [],
        "references": {},
        "meta": {
          "count_unknown": false,
          "for_each_unknown": false,
          "depends_on": [],
          "lifecycle": {}
        },
        "source": {
          "file": "main.tf",
          "range": {
            "start_line": 39,
            "start_column": 1,
            "end_line": 44,
            "end_column": 2
          },
          "attributes": {
            "cluster_identifier": {
              "start_line": 40,
              "start_column": 24,
              "end_line": 40,
              "end_column": 41
            },
            "engine": {
              "start_line": 41,
              "start_column": 24,
              "end_line": 41,
              "end_column": 43
            },
            "master_password": {
              "start_line": 43,
              "start_column": 24,
              "end_line": 43,
              "end_column": 55
            },
            "master_username": {
              "start_line": 42,
              "start_column": 24,
              "end_line": 42,
              "end_column": 29
            }
          }
        }
      },
      {
        "address": "aws_ssm_parameter.key",
        "base_address": "aws_ssm_parameter.key",
        "mode": "managed",
        "type": "aws_ssm_parameter",
        "name": "key",
        "index": null,
        "module": "",
        "provider": "registry.terraform.io/hashicorp/aws",
        "provider_config": "",
        "values": {
          "name": "/example/key",
          "type": "SecureString",
          "value": "<redacted>"
        },
        "unknown": [],
        "sensitive": [],
        "references": {},
        "meta": {
          "count_unknown": false,
          "for_each_unknown": false,
          "depends_on": [],
          "lifecycle": {}
        },
        "source": {
          "file": "main.tf",
          "range": {
            "start_line": 47,
            "start_column": 1,
            "end_line": 51,
            "end_column": 2
          },
          "attributes": {
            "name": {
              "start_line": 48,
              "start_column": 11,
              "end_line": 48,
              "end_column": 25
            },
            "type": {
              "start_line": 49,
              "start_column": 11,
              "end_line": 49,
              "end_column": 25
            },
            "value": {
              "start_line": 50,
              "start_column": 11,
              "end_line": 50,
              "end_column": 96
            }
          }
        }
      },
      {
        "address": "aws_ssm_parameter.note",
        "base_address": "aws_ssm_parameter.note",
        "mode": "managed",
        "type": "aws_ssm_parameter",
        "name": "note",
        "index": null,
        "module": "",
        "provider": "registry.terraform.io/hashicorp/aws",
        "provider_config": "",
        "values": {
          "name": "/example/note",
          "type": "String",
          "value": "<redacted>"
        },
        "unknown": [],
        "sensitive": [
          [
            "value"
          ]
        ],
        "references": {},
        "meta": {
          "count_unknown": false,
          "for_each_unknown": false,
          "depends_on": [],
          "lifecycle": {}
        },
        "source": {
          "file": "main.tf",
          "range": {
            "start_line": 32,
            "start_column": 1,
            "end_line": 36,
            "end_column": 2
          },
          "attributes": {
            "name": {
              "start_line": 33,
              "start_column": 11,
              "end_line": 33,
              "end_column": 26
            },
            "type": {
              "start_line": 34,
              "start_column": 11,
              "end_line": 34,
              "end_column": 19
            },
            "value": {
              "start_line": 35,
              "start_column": 11,
              "end_line": 35,
              "end_column": 26
            }
          }
        }
      }
    ],
    "module_calls": [],
    "variables": [
      {
        "name": "db_password",
        "module": "",
        "sensitive": true,
        "has_default": true,
        "type": "string"
      }
    ],
    "outputs": [],
    "coverage_gaps": []
  }
]
