[
  {
    "schema_version": "1",
    "source": {
      "kind": "hcl",
      "root_module": "."
    },
    "terraform": {
      "required_version": ">= 1.6",
      "backend": null,
      "required_providers": {
        "aws": {
          "source": "registry.terraform.io/hashicorp/aws",
          "version": "~> 6.0"
        }
      }
    },
    "provider_versions": {
      "registry.terraform.io/hashicorp/aws": "6.12.0"
    },
    "providers": [
      {
        "local_name": "aws",
        "alias": "",
        "source": "registry.terraform.io/hashicorp/aws",
        "values": {
          "region": null
        },
        "unknown": [
          [
            "region"
          ]
        ],
        "sensitive": [],
        "source_range": {
          "file": "main.tf",
          "range": {
            "start_line": 12,
            "start_column": 1,
            "end_line": 14,
            "end_column": 2
          }
        }
      }
    ],
    "resources": [
      {
        "address": "aws_s3_bucket.data",
        "base_address": "aws_s3_bucket.data",
        "mode": "managed",
        "type": "aws_s3_bucket",
        "name": "data",
        "index": null,
        "module": "",
        "provider": "registry.terraform.io/hashicorp/aws",
        "provider_config": "",
        "values": {
          "bucket": "example-prod-data",
          "tags": {
            "Environment": "prod"
          }
        },
        "unknown": [],
        "sensitive": [],
        "references": {},
        "meta": {
          "count_unknown": false,
          "for_each_unknown": false,
          "depends_on": [],
          "lifecycle": {}
        },
        "source": {
          "file": "main.tf",
          "range": {
            "start_line": 21,
            "start_column": 1,
            "end_line": 27,
            "end_column": 2
          },
          "attributes": {
            "bucket": {
              "start_line": 22,
              "start_column": 12,
              "end_line": 22,
              "end_column": 37
            },
            "tags": {
              "start_line": 24,
              "start_column": 10,
              "end_line": 26,
              "end_column": 4
            }
          }
        }
      },
      {
        "address": "aws_s3_bucket_public_access_block.data",
        "base_address": "aws_s3_bucket_public_access_block.data",
        "mode": "managed",
        "type": "aws_s3_bucket_public_access_block",
        "name": "data",
        "index": null,
        "module": "",
        "provider": "registry.terraform.io/hashicorp/aws",
        "provider_config": "",
        "values": {
          "block_public_acls": true,
          "block_public_policy": true,
          "bucket": null,
          "ignore_public_acls": true,
          "restrict_public_buckets": true
        },
        "unknown": [
          [
            "bucket"
          ]
        ],
        "sensitive": [],
        "references": {
          "bucket": [
            "aws_s3_bucket.data"
          ]
        },
        "meta": {
          "count_unknown": false,
          "for_each_unknown": false,
          "depends_on": [],
          "lifecycle": {}
        },
        "source": {
          "file": "main.tf",
          "range": {
            "start_line": 29,
            "start_column": 1,
            "end_line": 35,
            "end_column": 2
          },
          "attributes": {
            "block_public_acls": {
              "start_line": 31,
              "start_column": 29,
              "end_line": 31,
              "end_column": 33
            },
            "block_public_policy": {
              "start_line": 32,
              "start_column": 29,
              "end_line": 32,
              "end_column": 33
            },
            "bucket": {
              "start_line": 30,
              "start_column": 29,
              "end_line": 30,
              "end_column": 50
            },
            "ignore_public_acls": {
              "start_line": 33,
              "start_column": 29,
              "end_line": 33,
              "end_column": 33
            },
            "restrict_public_buckets": {
              "start_line": 34,
              "start_column": 29,
              "end_line": 34,
              "end_column": 33
            }
          }
        }
      },
      {
        "address": "module.logs.aws_s3_bucket.logs",
        "base_address": "module.logs.aws_s3_bucket.logs",
        "mode": "managed",
        "type": "aws_s3_bucket",
        "name": "logs",
        "index": null,
        "module": "module.logs",
        "provider": "registry.terraform.io/hashicorp/aws",
        "provider_config": "",
        "values": {
          "bucket": "example-prod-logs"
        },
        "unknown": [],
        "sensitive": [],
        "references": {},
        "meta": {
          "count_unknown": false,
          "for_each_unknown": false,
          "depends_on": [],
          "lifecycle": {}
        },
        "source": {
          "file": "modules/logs/main.tf",
          "range": {
            "start_line": 5,
            "start_column": 1,
            "end_line": 7,
            "end_column": 2
          },
          "attributes": {
            "bucket": {
              "start_line": 6,
              "start_column": 12,
              "end_line": 6,
              "end_column": 40
            }
          },
          "module_call": {
            "file": "main.tf",
            "range": {
              "start_line": 37,
              "start_column": 1,
              "end_line": 37,
              "end_column": 14
            }
          }
        }
      }
    ],
    "module_calls": [
      {
        "address": "module.logs",
        "source": "./modules/logs",
        "version": "",
        "resolved": true,
        "reason": "",
        "source_range": {
          "file": "main.tf",
          "range": {
            "start_line": 37,
            "start_column": 1,
            "end_line": 40,
            "end_column": 2
          }
        }
      }
    ],
    "variables": [
      {
        "name": "env",
        "module": "",
        "sensitive": false,
        "has_default": true,
        "type": "string"
      },
      {
        "name": "prefix",
        "module": "module.logs",
        "sensitive": false,
        "has_default": false,
        "type": "string"
      }
    ],
    "outputs": [
      {
        "name": "data_bucket",
        "module": "",
        "sensitive": false,
        "references": [
          "aws_s3_bucket.data"
        ],
        "source_range": {
          "file": "main.tf",
          "range": {
            "start_line": 42,
            "start_column": 1,
            "end_line": 42,
            "end_column": 21
          }
        }
      },
      {
        "name": "bucket",
        "module": "module.logs",
        "sensitive": false,
        "references": [
          "module.logs.aws_s3_bucket.logs"
        ],
        "source_range": {
          "file": "modules/logs/main.tf",
          "range": {
            "start_line": 9,
            "start_column": 1,
            "end_line": 9,
            "end_column": 16
          }
        }
      }
    ],
    "coverage_gaps": []
  }
]
